{
  "name": "Neurodiversity Directory",
  "url": "https://neurodiversity.directory/",
  "category": "support",
  "description": "A searchable directory of ADHD and autism communities including support groups, forums, and peer networks — covering both online and in-person options.",
  "featured": false
}
