{
  "name": "Emotions Matter",
  "url": "https://emotionsmatterbpd.org/",
  "category": "support",
  "description": "Free online peer support groups for people with BPD, facilitated by volunteers with lived experience. Groups run 75 minutes and are built around community guidelines developed by people with BPD themselves.",
  "featured": false
}
