{
  "name": "RewildNC",
  "url": "https://rewildnc.net/ords/r/rewildearth/re/home",
  "category": "communities",
  "description": "A searchable database of native plants, ecological restoration resources, and rewilding projects specific to North Carolina — a practical tool for restoring regional habitats and supporting local biodiversity.",
  "featured": false
}
