{
  "name": "Warmline.org",
  "url": "https://www.warmline.org/",
  "category": "support",
  "description": "A directory of peer-support warmlines by state — phone, chat, and text lines staffed by people with lived experience. Non-coercive, confidential, and explicitly not a crisis line. For distress, loneliness, or just needing to be heard.",
  "featured": true
}
